<?xml version="1.0" encoding="UTF-8"?>

<!-- generated on 2024-07-01 08:55:57 by Eclipse SUMO netconvert Version v1_20_0+1067-ecd6dc8927e
This data file and the accompanying materials
are made available under the terms of the Eclipse Public License v2.0
which accompanies this distribution, and is available at
http://www.eclipse.org/legal/epl-v20.html
This file may also be made available under the following Secondary
Licenses when the conditions for such availability set forth in the Eclipse
Public License 2.0 are satisfied: GNU General Public License, version 2
or later which is available at
https://www.gnu.org/licenses/old-licenses/gpl-2.0-standalone.html
SPDX-License-Identifier: EPL-2.0 OR GPL-2.0-or-later
<netconvertConfiguration xmlns:xsi="http://www.w3.org/2001/XMLSchema-instance" xsi:noNamespaceSchemaLocation="http://sumo.dlr.de/xsd/netconvertConfiguration.xsd">

    <input>
        <node-files value=".\netedit\network\lanes\select_vtypes\allowed\scooter\net.nod.xml"/>
        <edge-files value=".\netedit\network\lanes\select_vtypes\allowed\scooter\net.edg.xml"/>
        <connection-files value=".\netedit\network\lanes\select_vtypes\allowed\scooter\net.con.xml"/>
    </input>

    <output>
        <write-license value="true"/>
        <output-file value=".\netedit\network\lanes\select_vtypes\allowed\scooter\net.net.xml"/>
    </output>

    <processing>
        <offset.disable-normalization value="true"/>
    </processing>

    <report>
        <verbose value="true"/>
    </report>

</netconvertConfiguration>
-->

<net version="1.20" junctionCornerDetail="5" limitTurnSpeed="5.50" xmlns:xsi="http://www.w3.org/2001/XMLSchema-instance" xsi:noNamespaceSchemaLocation="http://sumo.dlr.de/xsd/net_file.xsd">

    <location netOffset="0.00,0.00" convBoundary="-60.00,-30.00,60.00,30.00" origBoundary="-60.00,-30.00,60.00,30.00" projParameter="!"/>

    <edge id=":J38_0" function="internal">
        <lane id=":J38_0_0" index="0" allow="scooter" speed="3.65" length="4.67" shape="-35.00,1.60 -36.20,0.80 -36.60,0.00 -36.20,-0.80 -35.00,-1.60"/>
    </edge>
    <edge id=":J39_0" function="internal">
        <lane id=":J39_0_0" index="0" allow="scooter" speed="3.65" length="4.67" shape="35.00,-1.60 36.20,-0.80 36.60,0.00 36.20,0.80 35.00,1.60"/>
    </edge>
    <edge id=":JunctionExtern0_0" function="internal">
        <lane id=":JunctionExtern0_0_0" index="0" disallow="pedestrian" speed="3.53" length="4.38" width="3.00" shape="-60.00,1.50 -61.12,0.75 -61.50,0.00 -61.12,-0.75 -60.00,-1.50"/>
    </edge>
    <edge id=":JunctionExtern1_0" function="internal">
        <lane id=":JunctionExtern1_0_0" index="0" disallow="pedestrian" speed="3.53" length="4.38" width="3.00" shape="60.00,-1.50 61.12,-0.75 61.50,0.00 61.12,0.75 60.00,1.50"/>
    </edge>

    <edge id="-E44" from="J39" to="J38" priority="-1">
        <lane id="-E44_0" index="0" disallow="all" speed="13.89" length="70.00" shape="35.00,4.80 -35.00,4.80"/>
        <lane id="-E44_1" index="1" allow="scooter" speed="13.89" length="70.00" shape="35.00,1.60 -35.00,1.60"/>
    </edge>
    <edge id="E44" from="J38" to="J39" priority="-1">
        <lane id="E44_0" index="0" disallow="all" speed="13.89" length="70.00" shape="-35.00,-4.80 35.00,-4.80"/>
        <lane id="E44_1" index="1" allow="scooter" speed="13.89" length="70.00" shape="-35.00,-1.60 35.00,-1.60"/>
    </edge>
    <edge id="EdgeExternBot" from="JunctionExtern0" to="JunctionExtern1" priority="-1" length="175.00" shape="-60.00,0.00 -45.00,0.00 -45.00,-25.00 -40.00,-30.00 40.00,-30.00 45.00,-25.00 45.00,0.00 60.00,0.00">
        <lane id="EdgeExternBot_0" index="0" disallow="pedestrian" speed="13.89" length="175.00" width="3.00" shape="-60.00,-1.50 -46.50,-1.50 -46.50,-25.62 -40.62,-31.50 40.62,-31.50 46.50,-25.62 46.50,-1.50 60.00,-1.50"/>
    </edge>
    <edge id="EdgeExternTop" from="JunctionExtern1" to="JunctionExtern0" priority="-1" length="175.00" shape="60.00,0.00 45.00,0.00 45.00,25.00 40.00,30.00 -40.00,30.00 -45.00,25.00 -45.00,0.00 -60.00,0.00">
        <lane id="EdgeExternTop_0" index="0" disallow="pedestrian" speed="13.89" length="175.00" width="3.00" shape="60.00,1.50 46.50,1.50 46.50,25.62 40.62,31.50 -40.62,31.50 -46.50,25.62 -46.50,1.50 -60.00,1.50"/>
    </edge>

    <junction id="J38" type="priority" x="-35.00" y="0.00" incLanes="-E44_0 -E44_1" intLanes=":J38_0_0" shape="-35.00,0.00 -35.00,3.20 -35.00,0.00">
        <request index="0" response="0" foes="0" cont="0"/>
    </junction>
    <junction id="J39" type="priority" x="35.00" y="0.00" incLanes="E44_0 E44_1" intLanes=":J39_0_0" shape="35.00,0.00 35.00,-3.20 35.00,0.00">
        <request index="0" response="0" foes="0" cont="0"/>
    </junction>
    <junction id="JunctionExtern0" type="priority" x="-60.00" y="0.00" incLanes="EdgeExternTop_0" intLanes=":JunctionExtern0_0_0" shape="-60.00,0.00 -60.00,3.00 -60.00,0.00">
        <request index="0" response="0" foes="0" cont="0"/>
    </junction>
    <junction id="JunctionExtern1" type="priority" x="60.00" y="0.00" incLanes="EdgeExternBot_0" intLanes=":JunctionExtern1_0_0" shape="60.00,0.00 60.00,-3.00 60.00,0.00">
        <request index="0" response="0" foes="0" cont="0"/>
    </junction>

    <connection from="-E44" to="E44" fromLane="1" toLane="1" via=":J38_0_0" dir="t" state="M"/>
    <connection from="E44" to="-E44" fromLane="1" toLane="1" via=":J39_0_0" dir="t" state="M"/>
    <connection from="EdgeExternBot" to="EdgeExternTop" fromLane="0" toLane="0" via=":JunctionExtern1_0_0" dir="t" state="M"/>
    <connection from="EdgeExternTop" to="EdgeExternBot" fromLane="0" toLane="0" via=":JunctionExtern0_0_0" dir="t" state="M"/>

    <connection from=":J38_0" to="E44" fromLane="0" toLane="1" dir="t" state="M"/>
    <connection from=":J39_0" to="-E44" fromLane="0" toLane="1" dir="t" state="M"/>
    <connection from=":JunctionExtern0_0" to="EdgeExternBot" fromLane="0" toLane="0" dir="t" state="M"/>
    <connection from=":JunctionExtern1_0" to="EdgeExternTop" fromLane="0" toLane="0" dir="t" state="M"/>

</net>
