<?xml version="1.0" encoding="UTF-8"?>

<!-- generated on 2024-09-20 11:51:48 by Eclipse SUMO netedit Version v1_20_0+2084-215f6555307
<neteditConfiguration xmlns:xsi="http://www.w3.org/2001/XMLSchema-instance" xsi:noNamespaceSchemaLocation="http://sumo.dlr.de/xsd/neteditConfiguration.xsd">

    <input>
        <sumo-net-file value="net.net.xml"/>
    </input>

    <output>
        <output-file value="net.net.xml"/>
        <output.street-names value="true"/>
    </output>

    <processing>
        <geometry.min-radius.fix.railways value="false"/>
        <geometry.max-grade.fix value="false"/>
        <offset.disable-normalization value="true"/>
        <lefthand value="0"/>
    </processing>

    <junctions>
        <no-internal-links value="true"/>
        <no-turnarounds value="true"/>
        <junctions.corner-detail value="5"/>
        <junctions.limit-turn-speed value="5.50"/>
        <rectangular-lane-cut value="0"/>
    </junctions>

    <pedestrian>
        <walkingareas value="0"/>
    </pedestrian>

</neteditConfiguration>
-->

<net version="1.20" junctionCornerDetail="5" limitTurnSpeed="5.50" xmlns:xsi="http://www.w3.org/2001/XMLSchema-instance" xsi:noNamespaceSchemaLocation="http://sumo.dlr.de/xsd/net_file.xsd">

    <location netOffset="0.00,0.00" convBoundary="-100.00,0.00,500.00,100.00" origBoundary="-10000000000.00,-10000000000.00,10000000000.00,10000000000.00" projParameter="!"/>

    <edge id="-E0" from="J1" to="J0" priority="-1" spreadType="center" bidi="E0">
        <lane id="-E0_0" index="0" allow="rail" speed="13.89" length="100.00" shape="-5.36,0.00 -100.00,0.00"/>
    </edge>
    <edge id="-E1" from="J2" to="J1" priority="-1" spreadType="center" bidi="E1">
        <lane id="-E1_0" index="0" allow="rail" speed="13.89" length="100.00" shape="100.00,0.00 2.16,0.00"/>
    </edge>
    <edge id="-E2" from="J3" to="J2" priority="-1" spreadType="center" bidi="E2">
        <lane id="-E2_0" index="0" allow="rail" speed="13.89" length="100.00" shape="194.64,0.00 100.00,0.00"/>
    </edge>
    <edge id="-E3" from="J4" to="J3" priority="-1" spreadType="center" bidi="E3">
        <lane id="-E3_0" index="0" allow="rail" speed="13.89" length="100.00" shape="300.00,0.00 202.16,0.00"/>
    </edge>
    <edge id="-E4" from="J5" to="J4" priority="-1" spreadType="center" bidi="E4">
        <lane id="-E4_0" index="0" allow="rail" speed="13.89" length="100.00" shape="400.00,0.00 300.00,0.00"/>
    </edge>
    <edge id="-E5" from="J1" to="J6" priority="-1" spreadType="center" bidi="E5">
        <lane id="-E5_0" index="0" allow="rail" speed="13.89" length="141.42" shape="-3.79,3.79 -100.00,100.00"/>
    </edge>
    <edge id="-E6" from="J3" to="J7" priority="-1" spreadType="center" bidi="E6">
        <lane id="-E6_0" index="0" allow="rail" speed="13.89" length="141.42" shape="196.21,3.79 100.00,100.00"/>
    </edge>
    <edge id="-E7" from="J8" to="J5" priority="-1" spreadType="center" bidi="E7">
        <lane id="-E7_0" index="0" allow="rail" speed="13.89" length="100.00" shape="500.00,0.00 400.00,0.00"/>
    </edge>
    <edge id="E0" from="J0" to="J1" priority="-1" spreadType="center" bidi="-E0">
        <lane id="E0_0" index="0" allow="rail" speed="13.89" length="100.00" shape="-100.00,0.00 -5.36,0.00"/>
    </edge>
    <edge id="E1" from="J1" to="J2" priority="-1" spreadType="center" bidi="-E1">
        <lane id="E1_0" index="0" allow="rail" speed="13.89" length="100.00" shape="2.16,0.00 100.00,0.00"/>
    </edge>
    <edge id="E2" from="J2" to="J3" priority="-1" spreadType="center" bidi="-E2">
        <lane id="E2_0" index="0" allow="rail" speed="13.89" length="100.00" shape="100.00,0.00 194.64,0.00"/>
    </edge>
    <edge id="E3" from="J3" to="J4" priority="-1" spreadType="center" bidi="-E3">
        <lane id="E3_0" index="0" allow="rail" speed="13.89" length="100.00" shape="202.16,0.00 300.00,0.00"/>
    </edge>
    <edge id="E4" from="J4" to="J5" priority="-1" spreadType="center" bidi="-E4">
        <lane id="E4_0" index="0" allow="rail" speed="13.89" length="100.00" shape="300.00,0.00 400.00,0.00"/>
    </edge>
    <edge id="E5" from="J6" to="J1" priority="-1" spreadType="center" bidi="-E5">
        <lane id="E5_0" index="0" allow="rail" speed="13.89" length="141.42" shape="-100.00,100.00 -3.79,3.79"/>
    </edge>
    <edge id="E6" from="J7" to="J3" priority="-1" spreadType="center" bidi="-E6">
        <lane id="E6_0" index="0" allow="rail" speed="13.89" length="141.42" shape="100.00,100.00 196.21,3.79"/>
    </edge>
    <edge id="E7" from="J5" to="J8" priority="-1" spreadType="center" bidi="-E7">
        <lane id="E7_0" index="0" allow="rail" speed="13.89" length="100.00" shape="400.00,0.00 500.00,0.00"/>
    </edge>

    <junction id="J0" type="dead_end" x="-100.00" y="0.00" incLanes="-E0_0" intLanes="" shape="-100.00,1.60 -100.00,-1.60 -100.00,1.60 -100.00,-1.60"/>
    <junction id="J1" type="priority" x="0.00" y="0.00" incLanes="-E1_0 E0_0 E5_0" intLanes="" shape="2.16,1.60 2.16,-1.60 -5.36,-1.60 -5.36,1.60 -4.65,1.72 -4.50,1.87 -4.50,2.07 -4.64,2.34 -4.92,2.66 -2.66,4.92 -0.65,3.08 0.21,2.43 0.96,1.97 1.61,1.69">
        <request index="0" response="0000" foes="0000"/>
        <request index="1" response="0000" foes="1000"/>
        <request index="2" response="0000" foes="1000"/>
        <request index="3" response="0110" foes="0110"/>
    </junction>
    <junction id="J2" type="rail_signal" x="100.00" y="0.00" incLanes="-E2_0 E1_0" intLanes="" shape="100.00,1.60 100.00,-1.60 100.00,1.60">
        <request index="0" response="00" foes="00"/>
        <request index="1" response="00" foes="00"/>
    </junction>
    <junction id="J3" type="priority" x="200.00" y="0.00" incLanes="-E3_0 E2_0 E6_0" intLanes="" shape="202.16,1.60 202.16,-1.60 194.64,-1.60 194.64,1.60 195.35,1.72 195.50,1.87 195.50,2.07 195.36,2.34 195.08,2.66 197.34,4.92 198.86,3.14 199.43,2.49 200.07,2.00 200.93,1.70">
        <request index="0" response="0000" foes="0000"/>
        <request index="1" response="0000" foes="1000"/>
        <request index="2" response="0000" foes="1000"/>
        <request index="3" response="0110" foes="0110"/>
    </junction>
    <junction id="J4" type="rail_signal" x="300.00" y="0.00" incLanes="-E4_0 E3_0" intLanes="" shape="300.00,1.60 300.00,-1.60 300.00,1.60">
        <request index="0" response="00" foes="00"/>
        <request index="1" response="00" foes="00"/>
    </junction>
    <junction id="J5" type="rail_signal" x="400.00" y="0.00" incLanes="-E7_0 E4_0" intLanes="" shape="400.00,1.60 400.00,-1.60 400.00,1.60">
        <request index="0" response="00" foes="00"/>
        <request index="1" response="00" foes="00"/>
    </junction>
    <junction id="J6" type="dead_end" x="-100.00" y="100.00" incLanes="-E5_0" intLanes="" shape="-98.87,101.13 -101.13,98.87 -98.87,101.13 -101.13,98.87"/>
    <junction id="J7" type="dead_end" x="100.00" y="100.00" incLanes="-E6_0" intLanes="" shape="101.13,101.13 98.87,98.87 101.13,101.13 98.87,98.87"/>
    <junction id="J8" type="dead_end" x="500.00" y="0.00" incLanes="E7_0" intLanes="" shape="500.00,-1.60 500.00,1.60 500.00,-1.60 500.00,1.60"/>

    <connection from="-E1" to="-E5" fromLane="0" toLane="0" dir="r" state="M"/>
    <connection from="-E1" to="-E0" fromLane="0" toLane="0" dir="s" state="M"/>
    <connection from="-E2" to="-E1" fromLane="0" toLane="0" uncontrolled="1" dir="s" state="M"/>
    <connection from="-E3" to="-E6" fromLane="0" toLane="0" dir="r" state="M"/>
    <connection from="-E3" to="-E2" fromLane="0" toLane="0" dir="s" state="M"/>
    <connection from="-E4" to="-E3" fromLane="0" toLane="0" tl="J4" linkIndex="0" dir="s" state="O"/>
    <connection from="-E7" to="-E4" fromLane="0" toLane="0" tl="J5" linkIndex="0" dir="s" state="o"/>
    <connection from="E0" to="E1" fromLane="0" toLane="0" dir="s" state="M"/>
    <connection from="E1" to="E2" fromLane="0" toLane="0" tl="J2" linkIndex="0" dir="s" state="O"/>
    <connection from="E2" to="E3" fromLane="0" toLane="0" dir="s" state="M"/>
    <connection from="E3" to="E4" fromLane="0" toLane="0" uncontrolled="1" dir="s" state="M"/>
    <connection from="E4" to="E7" fromLane="0" toLane="0" uncontrolled="1" dir="s" state="M"/>
    <connection from="E5" to="E1" fromLane="0" toLane="0" dir="l" state="M"/>
    <connection from="E6" to="E3" fromLane="0" toLane="0" dir="l" state="M"/>

</net>
