<?xml version="1.0" encoding="UTF-8"?>

<!-- generated on Thu 04 Oct 2012 03:49:47 PM CEST by Netedit Version dev-SVN-r12771
<?xml version="1.0" encoding="UTF-8"?>

<configuration xmlns:xsi="http://www.w3.org/2001/XMLSchema-instance" xsi:noNamespaceSchemaLocation="http://sumo-sim.org/xsd/netedit.exeConfiguration.xsd">

    <input>
        <sumo-net-file value="/home/erdm_ja/debug/bottleneck_capacity/net.net.xml"/>
    </input>

    <output>
        <output-file value="/home/erdm_ja/debug/bottleneck_capacity/net.net.xml"/>
    </output>

    <processing>
        <no-internal-links value="true"/>
        <no-turnarounds value="true"/>
        <offset.disable-normalization value="true"/>
    </processing>

</configuration>
-->

<net version="0.13" xmlns:xsi="http://www.w3.org/2001/XMLSchema-instance" xsi:noNamespaceSchemaLocation="http://sumo-sim.org/xsd/net_file.xsd">

    <location netOffset="0.00,0.00" convBoundary="-500.00,-100.00,500.00,100.00" origBoundary="-10000000000.00,-10000000000.00,10000000000.00,10000000000.00" projParameter="!"/>

    <edge id="in1" from="gneJ0" to="gneJ1" priority="1">
        <lane id="in1_0" index="0" speed="13.89" length="492.81" shape="-500.97,95.15 -17.73,-1.50"/>
        <lane id="in1_1" index="1" speed="13.89" length="492.81" shape="-500.32,98.38 -17.08,1.73"/>
    </edge>
    <edge id="in2" from="gneJ2" to="gneJ1" priority="1">
        <lane id="in2_0" index="0" speed="13.89" length="491.49" shape="-499.03,-104.85 -17.08,-8.46"/>
        <lane id="in2_1" index="1" speed="13.89" length="491.49" shape="-499.68,-101.62 -17.73,-5.23"/>
    </edge>
    <edge id="out" from="gneJ1" to="gneJ3" priority="1">
        <lane id="out_0" index="0" speed="13.89" length="498.50" shape="1.50,-1.65 500.00,-1.65"/>
    </edge>

    <junction id="gneJ0" type="unregulated" x="-500.00" y="100.00" incLanes="" intLanes="" shape="-500.01,99.95 -501.28,93.58">
    </junction>
    <junction id="gneJ1" type="priority" x="0.00" y="0.00" incLanes="in2_0 in2_1 in1_0 in1_1" intLanes="" shape="1.50,-0.05 1.50,-3.25 -16.77,-10.03 -18.04,-3.66 -18.04,-3.07 -16.77,3.30">
        <request index="0" response="00" foes="10"/>
        <request index="1" response="01" foes="01"/>
    </junction>
    <junction id="gneJ2" type="unregulated" x="-500.00" y="-100.00" incLanes="" intLanes="" shape="-499.99,-100.05 -498.72,-106.42">
    </junction>
    <junction id="gneJ3" type="unregulated" x="500.00" y="0.00" incLanes="out_0" intLanes="" shape="500.00,-3.25 500.00,-0.05">
    </junction>

    <connection from="in1" to="out" fromLane="0" toLane="0" dir="s" state="m"/>
    <connection from="in2" to="out" fromLane="0" toLane="0" dir="s" state="M"/>

</net>
