<?xml version="1.0" encoding="UTF-8"?>

<!-- generated on 2026-06-18T14:47:08.245863+01:00 by Eclipse SUMO netedit v1_27_0+0254-729049c22fc
<neteditConfiguration xmlns:xsi="http://www.w3.org/2001/XMLSchema-instance" xsi:noNamespaceSchemaLocation="http://sumo.dlr.de/xsd/neteditConfiguration.xsd">

    <input>
        <sumo-net-file value="input_net.net.xml"/>
    </input>

    <output>
        <output-file value="input_net.net.xml"/>
    </output>

    <processing>
        <geometry.min-radius.fix.railways value="false"/>
        <geometry.avoid-overlap value="false"/>
        <geometry.max-grade.fix value="false"/>
        <offset.disable-normalization value="true"/>
    </processing>

    <junctions>
        <no-turnarounds value="true"/>
        <junctions.corner-detail value="0"/>
        <junctions.limit-turn-speed value="-1.00"/>
    </junctions>

</neteditConfiguration>
-->

<net version="1.20" avoidOverlap="0" xmlns:xsi="http://www.w3.org/2001/XMLSchema-instance" xsi:noNamespaceSchemaLocation="http://sumo.dlr.de/xsd/net_file.xsd">

    <location netOffset="100.00,100.00" convBoundary="100.00,0.00,200.00,200.00" origBoundary="-10000000000.00,-10000000000.00,10000000000.00,10000000000.00" projParameter="!"/>

    <edge id=":C_0" function="internal">
        <lane id=":C_0_0" index="0" speed="13.89" length="34.84" shape="104.80,73.60 106.15,83.05 110.20,89.80 116.95,93.85 126.40,95.20"/>
        <lane id=":C_0_1" index="1" speed="13.89" length="37.45" shape="104.80,73.60 106.15,84.45 110.20,92.20 116.95,96.85 126.40,98.40"/>
    </edge>
    <edge id=":C_2" function="internal">
        <lane id=":C_2_0" index="0" speed="13.89" length="46.40" shape="104.80,73.60 104.80,120.00"/>
        <lane id=":C_2_1" index="1" speed="13.89" length="46.40" shape="101.60,73.60 101.60,120.00"/>
    </edge>

    <edge id="CE" from="C" to="E" priority="2">
        <lane id="CE_0" index="0" speed="13.89" length="73.60" shape="126.40,95.20 200.00,95.20">
            <param key="lk1" value="lv1"/>
            <param key="lk2" value="lv2"/>
        </lane>
        <lane id="CE_1" index="1" speed="13.89" length="73.60" shape="126.40,98.40 200.00,98.40">
            <param key="lk3" value="lv3"/>
            <param key="lk4" value="lv4"/>
        </lane>
        <param key="ek1" value="ev1"/>
        <param key="ek2" value="ev2"/>
        <param key="ek3" value="ev3"/>
        <param key="ek4" value="ev4"/>
    </edge>
    <edge id="CN" from="C" to="N" priority="2">
        <lane id="CN_0" index="0" speed="13.89" length="80.00" shape="104.80,120.00 104.80,200.00"/>
        <lane id="CN_1" index="1" speed="13.89" length="80.00" shape="101.60,120.00 101.60,200.00"/>
    </edge>
    <edge id="NS" from="N" to="S" priority="-1">
        <lane id="NS_0" index="0" speed="13.89" length="200.00" shape="95.20,200.00 95.20,0.00"/>
        <lane id="NS_1" index="1" speed="13.89" length="200.00" shape="98.40,200.00 98.40,0.00"/>
    </edge>
    <edge id="SC" from="S" to="C" priority="2">
        <lane id="SC_0" index="0" speed="13.89" length="73.60" shape="104.80,0.00 104.80,73.60"/>
        <lane id="SC_1" index="1" speed="13.89" length="73.60" shape="101.60,0.00 101.60,73.60"/>
    </edge>

    <junction id="C" type="priority" x="100.00" y="100.00" incLanes="SC_0 SC_1" intLanes=":C_0_0 :C_0_1 :C_2_0 :C_2_1" shape="100.00,120.00 106.40,120.00 126.40,100.00 126.40,93.60 106.40,73.60 100.00,73.60" radius="20.00">
        <request index="0" response="0000" foes="0000" cont="0"/>
        <request index="1" response="0000" foes="0000" cont="0"/>
        <request index="2" response="0000" foes="0000" cont="0"/>
        <request index="3" response="0000" foes="0000" cont="0"/>
        <param key="jk1" value="jv1"/>
        <param key="jk2" value="jv2"/>
    </junction>
    <junction id="E" type="dead_end" x="200.00" y="100.00" incLanes="CE_0 CE_1" intLanes="" shape="200.00,93.60 200.00,100.00"/>
    <junction id="N" type="dead_end" x="100.00" y="200.00" incLanes="CN_0 CN_1" intLanes="" shape="100.00,200.00 106.40,200.00 100.00,200.00"/>
    <junction id="S" type="dead_end" x="100.00" y="0.00" incLanes="NS_0 NS_1" intLanes="" shape="100.00,0.00 93.60,0.00 100.00,0.00"/>

    <connection from="SC" to="CE" fromLane="0" toLane="0" via=":C_0_0" dir="r" state="M"/>
    <connection from="SC" to="CE" fromLane="0" toLane="1" via=":C_0_1" dir="r" state="M"/>
    <connection from="SC" to="CN" fromLane="0" toLane="0" via=":C_2_0" dir="s" state="M"/>
    <connection from="SC" to="CN" fromLane="1" toLane="1" via=":C_2_1" dir="s" state="M"/>

    <connection from=":C_0" to="CE" fromLane="0" toLane="0" dir="r" state="M"/>
    <connection from=":C_0" to="CE" fromLane="1" toLane="1" dir="r" state="M"/>
    <connection from=":C_2" to="CN" fromLane="0" toLane="0" dir="s" state="M"/>
    <connection from=":C_2" to="CN" fromLane="1" toLane="1" dir="s" state="M"/>

</net>
